{"ontology_version_id":"ontology_v1","project_id":"project_golden","version_no":1,"labels":[{"label_id":"label_person","name":"person","color":"#3366ff","shortcut":null,"allowed_geometry_types":["bbox_xyxy"],"attributes":[{"key":"helmet_state","kind":"enum","required":true,"default_value":"unknown","enum_values":["wearing","not_wearing","unknown"],"min":null,"max":null}]}],"guidelines_markdown":"Golden fixture for public domain contract tests.","allow_out_of_bounds":false}